<?xml version="1.0" encoding="UTF-8"?>
<Pais  xmlns:xsi="http://www.w3.org/2001/XMLSchema-instance"  xsi:noNamespaceSchemaLocation="DATOS_ESTRUCTURA.xsd">
	<E>0.5</E>
	<P>2</P>
	<V>5</V>
	<maxDias>2</maxDias>
	<Comunidades>
		<Comunidad>
			<nombre>Andalucia</nombre>
			<poblacion>1000</poblacion>
		</Comunidad>
		<Comunidad>
			<nombre>Madrid</nombre>
			<poblacion>2000</poblacion>
		</Comunidad>
	</Comunidades>
</Pais>